<?xml version="1.0"?>
<character
    xmlns="http://charactermanaj.sourceforge.jp/schema/charactermanaj"
    xmlns:xml="http://www.w3.org/XML/1998/namespace"
    xmlns:xsi="http://www.w3.org/2001/XMLSchema-instance"
    xsi:schemaLocation="http://charactermanaj.sourceforge.jp/schema/charactermanaj character.xsd"
    version="1.0"
    id="default"
    rev="default_v3">

    <name xml:lang="en">Default(v3)</name>
    <name xml:lang="ja">デフォルト(v3)</name>

    <information>
    	<author xml:lang="en">Unknown</author>
    	<author xml:lang="ja">名無し</author>
        <author xml:lang="zh">无名</author>
        <author xml:lang="zh_TW">無名</author>
    	<description xml:lang="en"><![CDATA[default character]]></description>
    	<description xml:lang="ja"><![CDATA[デフォルトのキャラクター(キャラクターなんとか機Ver3互換セット)]]></description>
    </information>

    <image-size>
        <width>300</width>
        <height>400</height>
    </image-size>

    <settings>
        <entry key="watch-dir">true</entry>
    </settings>

    <categories>
        <category id="hair_front" multipleSelectable="false">
            <visible-rows>6</visible-rows>
            <display-name xml:lang="en">Hair - Front</display-name>
            <display-name xml:lang="ja">髪型 - 手前</display-name>
            <display-name xml:lang="zh">发型 - 这边</display-name>
            <display-name xml:lang="zh_TW">髮型 - 這邊</display-name>
            <layers>
                <layer id="hair_front">
                    <display-name xml:lang="en">Variable</display-name>
                    <display-name xml:lang="ja">可変色</display-name>
                    <display-name xml:lang="zh">可变颜色</display-name>
                    <display-name xml:lang="zh_TW">可變顏色</display-name>
                    <order>13</order>
                    <colorGroup refid="color-hair" init-sync="true"/>
                    <dir>hair_front</dir>
                    <colorModel>HSB</colorModel>
                </layer>
                <layer id="hair_front_accessory">
                    <display-name xml:lang="en">Accessory</display-name>
                    <display-name xml:lang="ja">アクセサリ</display-name>
                    <display-name xml:lang="zh">饰品</display-name>
                    <display-name xml:lang="zh_TW">飾品</display-name>
                    <order>14</order>
                    <dir>hair_front_accessory</dir>
                    <colorModel>HSB</colorModel>
                </layer>
            </layers>
        </category>
        <category id="hair_back" multipleSelectable="false">
            <visible-rows>6</visible-rows>
            <display-name xml:lang="en">Hair - Back</display-name>
            <display-name xml:lang="ja">髪型 - 後ろ</display-name>
            <display-name xml:lang="zh">发型 - 背后</display-name>
            <display-name xml:lang="zh_TW">髮型 - 背後</display-name>
            <layers>
                <layer id="hair_back">
                    <display-name xml:lang="en">Variable</display-name>
                    <display-name xml:lang="ja">可変色</display-name>
                    <display-name xml:lang="zh">可变颜色</display-name>
                    <display-name xml:lang="zh_TW">可變顏色</display-name>
                    <order>2</order>
                    <colorGroup refid="color-hair" init-sync="true"/>
                    <dir>hair_back</dir>
                    <colorModel>HSB</colorModel>
                </layer>
                <layer id="hair_back_accessory">
                    <display-name xml:lang="en">Accessory</display-name>
                    <display-name xml:lang="ja">アクセサリ</display-name>
                    <display-name xml:lang="zh">饰品</display-name>
                    <display-name xml:lang="zh_TW">飾品</display-name>
                    <order>3</order>
                    <dir>hair_back_accessory</dir>
                    <colorModel>HSB</colorModel>
                </layer>
            </layers>
        </category>
        <category id="head" multipleSelectable="false">
            <visible-rows>6</visible-rows>
            <display-name xml:lang="en">Head</display-name>
            <display-name xml:lang="ja">頭</display-name>
            <display-name xml:lang="zh">头</display-name>
            <display-name xml:lang="zh_TW">頭</display-name>
            <layers>
                <layer id="head">
                    <display-name xml:lang="en">Head</display-name>
                    <display-name xml:lang="ja">頭</display-name>
                    <display-name xml:lang="zh">头</display-name>
                    <display-name xml:lang="zh_TW">頭</display-name>
                    <order>10</order>
                    <colorGroup refid="color-skin" init-sync="true"/>
                    <dir>head</dir>
                    <colorModel>HSB</colorModel>
                </layer>
            </layers>
        </category>
        <category id="face" multipleSelectable="false">
            <visible-rows>6</visible-rows>
            <display-name xml:lang="en">Expression</display-name>
            <display-name xml:lang="ja">表情</display-name>
            <display-name xml:lang="zh">脸色</display-name>
            <display-name xml:lang="zh_TW">臉色</display-name>
            <layers>
                <layer id="face_front">    
                    <display-name xml:lang="en">Face</display-name>
                    <display-name xml:lang="ja">表情</display-name>
                    <display-name xml:lang="zh">脸色</display-name>
                    <display-name xml:lang="zh_TW">臉色</display-name>
                    <order>15</order>
                    <dir>face_front</dir>
                    <colorModel>HSB</colorModel>
                </layer>
                <layer id="face_back">
                    <display-name xml:lang="en">Accessory</display-name>
                    <display-name xml:lang="ja">アクセサリ</display-name>
                    <display-name xml:lang="zh">饰品</display-name>
                    <display-name xml:lang="zh_TW">飾品</display-name>
                    <order>12</order>
                    <dir>face_back</dir>
                    <colorModel>HSB</colorModel>
                </layer>
                <layer id="face_haircolor">
                    <display-name xml:lang="en">Hair</display-name>
                    <display-name xml:lang="ja">髪色</display-name>
                    <display-name xml:lang="zh">头发颜色</display-name>
                    <display-name xml:lang="zh_TW">頭髮顏色</display-name>
                    <order>16</order>
                    <colorGroup refid="color-hair" init-sync="true"/>
                    <dir>face_haircolor</dir>
                    <colorModel>HSB</colorModel>
                </layer>
            </layers>
        </category>
        <category id="eye" multipleSelectable="false">
            <visible-rows>6</visible-rows>
            <display-name xml:lang="en">Eyes</display-name>
            <display-name xml:lang="ja">目</display-name>
            <display-name xml:lang="zh">眼</display-name>
            <display-name xml:lang="zh_TW">眼</display-name>
            <layers>
                <layer id="eye">
                    <display-name xml:lang="en">Eye</display-name>
                    <display-name xml:lang="ja">目</display-name>
                    <display-name xml:lang="zh">眼</display-name>
                    <display-name xml:lang="zh_TW">眼</display-name>
                    <order>17</order>
                    <dir>eye</dir>
                    <colorModel>HSB</colorModel>
                </layer>
                <layer id="eye_color">
                    <display-name xml:lang="en">Variable</display-name>
                    <display-name xml:lang="ja">可変色</display-name>
                    <display-name xml:lang="zh">可变颜色</display-name>
                    <display-name xml:lang="zh_TW">可變顏色</display-name>
                    <order>18</order>
                    <colorGroup refid="color-eye" init-sync="true"/>
                    <dir>eye_color</dir>
                    <colorModel>HSB</colorModel>
                </layer>
            </layers>
        </category>
        <category id="body" multipleSelectable="false">
            <visible-rows>6</visible-rows>
            <display-name xml:lang="en">Body</display-name>
            <display-name xml:lang="ja">身体</display-name>
            <display-name xml:lang="zh">身体</display-name>
            <display-name xml:lang="zh_TW">身體</display-name>
            <layers>
                <layer id="body_front_color">
                    <display-name xml:lang="en">Variable</display-name>
                    <display-name xml:lang="ja">可変色</display-name>
                    <display-name xml:lang="zh">可变颜色</display-name>
                    <display-name xml:lang="zh_TW">可變顏色</display-name>
                    <order>7</order>
                    <colorGroup init-sync="true" refid="color-dress"/>
                    <dir>body_front_color</dir>
                    <colorModel>HSB</colorModel>
                </layer>
                <layer id="body_front">
                    <display-name xml:lang="en">Clothes</display-name>
                    <display-name xml:lang="ja">ドレス</display-name>
                    <display-name xml:lang="zh">衣服</display-name>
                    <display-name xml:lang="zh_TW">衣服</display-name>
                    <order>6</order>
                    <dir>body_front</dir>
                    <colorModel>HSB</colorModel>
                </layer>
                <layer id="body_back">
                    <display-name xml:lang="en">Skin</display-name>
                    <display-name xml:lang="ja">肌</display-name>
                    <display-name xml:lang="zh">皮肤</display-name>
                    <display-name xml:lang="zh_TW">皮膚</display-name>